28.06.2025
28.06.2025 r.
28-06-2025
2025-06-28
28/06/2025
28.6.2025
28 lipcae 2025
02.05.2023
02.05.2023 r.
02-05-2023
2023-05-02
02/05/2023
2.5.2023
02 maj 2023
27.11.2016
27.11.2016 r.
27-11-2016
2016-11-27
27/11/2016
27 listopada 2016
29.05.2023
29.05.2023 r.
29-05-2023
2023-05-29
29/05/2023
29.5.2023
29 maj 2023
13.10.2017
13.10.2017 r.
13-10-2017
2017-10-13
13/10/2017
13 October 2017
12.11.2024
12.11.2024 r.
12-11-2024
2024-11-12
12/11/2024
12 listopada 2024
30.03.2015
30.03.2015 r.
30-03-2015
2015-03-30
30/03/2015
30.3.2015
30 marca 2015
14.11.2018
14.11.2018 r.
14-11-2018
2018-11-14
14/11/2018
14 listopada 2018
06.09.2019
06.09.2019 r.
06-09-2019
2019-09-06
06/09/2019
6.9.2019
06 września 2019
17.06.2015
17.06.2015 r.
17-06-2015
2015-06-17
17/06/2015
17.6.2015
17 lipcae 2015
24.06.2016
24.06.2016 r.
24-06-2016
2016-06-24
24/06/2016
24.6.2016
24 lipcae 2016
14.03.2020
14.03.2020 r.
14-03-2020
2020-03-14
14/03/2020
14.3.2020
14 marca 2020
10.05.2020
10.05.2020 r.
10-05-2020
2020-05-10
10/05/2020
10.5.2020
10 maj 2020
20.07.2021
20.07.2021 r.
20-07-2021
2021-07-20
20/07/2021
20.7.2021
20 czerwca 2021
04.11.2025
04.11.2025 r.
04-11-2025
2025-11-04
04/11/2025
4.11.2025
04 listopada 2025
19.09.2017
19.09.2017 r.
19-09-2017
2017-09-19
19/09/2017
19.9.2017
19 września 2017
25.04.2019
25.04.2019 r.
25-04-2019
2019-04-25
25/04/2019
25.4.2019
25 kwietnia 2019
12.10.2018
12.10.2018 r.
12-10-2018
2018-10-12
12/10/2018
12 October 2018
10.08.2018
10.08.2018 r.
10-08-2018
2018-08-10
10/08/2018
10.8.2018
10 August 2018
17.11.2024
17.11.2024 r.
17-11-2024
2024-11-17
17/11/2024
17 listopada 2024
20.08.2016
20.08.2016 r.
20-08-2016
2016-08-20
20/08/2016
20.8.2016
20 August 2016
09.06.2015
09.06.2015 r.
09-06-2015
2015-06-09
09/06/2015
9.6.2015
09 lipcae 2015
12.05.2019
12.05.2019 r.
12-05-2019
2019-05-12
12/05/2019
12.5.2019
12 maj 2019
16.05.2025
16.05.2025 r.
16-05-2025
2025-05-16
16/05/2025
16.5.2025
16 maj 2025
24.04.2025
24.04.2025 r.
24-04-2025
2025-04-24
24/04/2025
24.4.2025
24 kwietnia 2025
30.10.2024
30.10.2024 r.
30-10-2024
2024-10-30
30/10/2024
30 October 2024
11.04.2025
11.04.2025 r.
11-04-2025
2025-04-11
11/04/2025
11.4.2025
11 kwietnia 2025
01.08.2019
01.08.2019 r.
01-08-2019
2019-08-01
01/08/2019
1.8.2019
01 August 2019
19.11.2016
19.11.2016 r.
19-11-2016
2016-11-19
19/11/2016
19 listopada 2016
17.06.2020
17.06.2020 r.
17-06-2020
2020-06-17
17/06/2020
17.6.2020
17 lipcae 2020
17.05.2023
17.05.2023 r.
17-05-2023
2023-05-17
17/05/2023
17.5.2023
17 maj 2023
12.10.2015
12.10.2015 r.
12-10-2015
2015-10-12
12/10/2015
12 October 2015
28.11.2020
28.11.2020 r.
28-11-2020
2020-11-28
28/11/2020
28 listopada 2020
29.07.2020
29.07.2020 r.
29-07-2020
2020-07-29
29/07/2020
29.7.2020
29 czerwca 2020
24.03.2023
24.03.2023 r.
24-03-2023
2023-03-24
24/03/2023
24.3.2023
24 marca 2023
18.11.2025
18.11.2025 r.
18-11-2025
2025-11-18
18/11/2025
18 listopada 2025
05.06.2015
05.06.2015 r.
05-06-2015
2015-06-05
05/06/2015
5.6.2015
05 lipcae 2015
05.12.2023
05.12.2023 r.
05-12-2023
2023-12-05
05/12/2023
5.12.2023
05 December 2023
25.11.2020
25.11.2020 r.
25-11-2020
2020-11-25
25/11/2020
25 listopada 2020
01.12.2024
01.12.2024 r.
01-12-2024
2024-12-01
01/12/2024
1.12.2024
01 December 2024
23.10.2020
23.10.2020 r.
23-10-2020
2020-10-23
23/10/2020
23 October 2020
15.02.2020
15.02.2020 r.
15-02-2020
2020-02-15
15/02/2020
15.2.2020
15 lutego 2020
16.10.2020
16.10.2020 r.
16-10-2020
2020-10-16
16/10/2020
16 October 2020
29.11.2022
29.11.2022 r.
29-11-2022
2022-11-29
29/11/2022
29 listopada 2022
24.08.2020
24.08.2020 r.
24-08-2020
2020-08-24
24/08/2020
24.8.2020
24 August 2020
26.09.2023
26.09.2023 r.
26-09-2023
2023-09-26
26/09/2023
26.9.2023
26 września 2023
16.04.2021
16.04.2021 r.
16-04-2021
2021-04-16
16/04/2021
16.4.2021
16 kwietnia 2021
14.10.2023
14.10.2023 r.
14-10-2023
2023-10-14
14/10/2023
14 October 2023
04.10.2017
04.10.2017 r.
04-10-2017
2017-10-04
04/10/2017
4.10.2017
04 October 2017
07.08.2021
07.08.2021 r.
07-08-2021
2021-08-07
07/08/2021
7.8.2021
07 August 2021
23.08.2017
23.08.2017 r.
23-08-2017
2017-08-23
23/08/2017
23.8.2017
23 August 2017
26.07.2019
26.07.2019 r.
26-07-2019
2019-07-26
26/07/2019
26.7.2019
26 czerwca 2019
17.07.2019
17.07.2019 r.
17-07-2019
2019-07-17
17/07/2019
17.7.2019
17 czerwca 2019
06.06.2020
06.06.2020 r.
06-06-2020
2020-06-06
06/06/2020
6.6.2020
06 lipcae 2020
11.01.2017
11.01.2017 r.
11-01-2017
2017-01-11
11/01/2017
11.1.2017
11 stycznia 2017
08.03.2023
08.03.2023 r.
08-03-2023
2023-03-08
08/03/2023
8.3.2023
08 marca 2023
29.01.2022
29.01.2022 r.
29-01-2022
2022-01-29
29/01/2022
29.1.2022
29 stycznia 2022
03.03.2015
03.03.2015 r.
03-03-2015
2015-03-03
03/03/2015
3.3.2015
03 marca 2015
02.03.2020
02.03.2020 r.
02-03-2020
2020-03-02
02/03/2020
2.3.2020
02 marca 2020
23.04.2023
23.04.2023 r.
23-04-2023
2023-04-23
23/04/2023
23.4.2023
23 kwietnia 2023
11.09.2023
11.09.2023 r.
11-09-2023
2023-09-11
11/09/2023
11.9.2023
11 września 2023
25.04.2017
25.04.2017 r.
25-04-2017
2017-04-25
25/04/2017
25.4.2017
25 kwietnia 2017
01.06.2017
01.06.2017 r.
01-06-2017
2017-06-01
01/06/2017
1.6.2017
01 lipcae 2017
22.04.2016
22.04.2016 r.
22-04-2016
2016-04-22
22/04/2016
22.4.2016
22 kwietnia 2016
06.08.2020
06.08.2020 r.
06-08-2020
2020-08-06
06/08/2020
6.8.2020
06 August 2020
05.06.2023
05.06.2023 r.
05-06-2023
2023-06-05
05/06/2023
5.6.2023
05 lipcae 2023
08.01.2024
08.01.2024 r.
08-01-2024
2024-01-08
08/01/2024
8.1.2024
08 stycznia 2024
26.01.2024
26.01.2024 r.
26-01-2024
2024-01-26
26/01/2024
26.1.2024
26 stycznia 2024
31.10.2022
31.10.2022 r.
31-10-2022
2022-10-31
31/10/2022
31 October 2022
14.01.2016
14.01.2016 r.
14-01-2016
2016-01-14
14/01/2016
14.1.2016
14 stycznia 2016
12.10.2024
12.10.2024 r.
12-10-2024
2024-10-12
12/10/2024
12 October 2024
09.06.2023
09.06.2023 r.
09-06-2023
2023-06-09
09/06/2023
9.6.2023
09 lipcae 2023
02.02.2019
02.02.2019 r.
02-02-2019
2019-02-02
02/02/2019
2.2.2019
02 lutego 2019
18.02.2023
18.02.2023 r.
18-02-2023
2023-02-18
18/02/2023
18.2.2023
18 lutego 2023
02.09.2022
02.09.2022 r.
02-09-2022
2022-09-02
02/09/2022
2.9.2022
02 września 2022
03.02.2020
03.02.2020 r.
03-02-2020
2020-02-03
03/02/2020
3.2.2020
03 lutego 2020
28.06.2021
28.06.2021 r.
28-06-2021
2021-06-28
28/06/2021
28.6.2021
28 lipcae 2021
23.01.2023
23.01.2023 r.
23-01-2023
2023-01-23
23/01/2023
23.1.2023
23 stycznia 2023
15.09.2020
15.09.2020 r.
15-09-2020
2020-09-15
15/09/2020
15.9.2020
15 września 2020
04.07.2022
04.07.2022 r.
04-07-2022
2022-07-04
04/07/2022
4.7.2022
04 czerwca 2022
17.08.2019
17.08.2019 r.
17-08-2019
2019-08-17
17/08/2019
17.8.2019
17 August 2019
03.04.2022
03.04.2022 r.
03-04-2022
2022-04-03
03/04/2022
3.4.2022
03 kwietnia 2022
29.10.2025
29.10.2025 r.
29-10-2025
2025-10-29
29/10/2025
29 October 2025
20.04.2024
20.04.2024 r.
20-04-2024
2024-04-20
20/04/2024
20.4.2024
20 kwietnia 2024
10.05.2023
10.05.2023 r.
10-05-2023
2023-05-10
10/05/2023
10.5.2023
10 maj 2023
13.07.2022
13.07.2022 r.
13-07-2022
2022-07-13
13/07/2022
13.7.2022
13 czerwca 2022
21.08.2021
21.08.2021 r.
21-08-2021
2021-08-21
21/08/2021
21.8.2021
21 August 2021
10.03.2025
10.03.2025 r.
10-03-2025
2025-03-10
10/03/2025
10.3.2025
10 marca 2025
16.04.2022
16.04.2022 r.
16-04-2022
2022-04-16
16/04/2022
16.4.2022
16 kwietnia 2022
22.10.2019
22.10.2019 r.
22-10-2019
2019-10-22
22/10/2019
22 October 2019
22.05.2025
22.05.2025 r.
22-05-2025
2025-05-22
22/05/2025
22.5.2025
22 maj 2025
19.03.2019
19.03.2019 r.
19-03-2019
2019-03-19
19/03/2019
19.3.2019
19 marca 2019
03.05.2017
03.05.2017 r.
03-05-2017
2017-05-03
03/05/2017
3.5.2017
03 maj 2017
20.02.2017
20.02.2017 r.
20-02-2017
2017-02-20
20/02/2017
20.2.2017
20 lutego 2017
20.04.2018
20.04.2018 r.
20-04-2018
2018-04-20
20/04/2018
20.4.2018
20 kwietnia 2018
12.01.2021
12.01.2021 r.
12-01-2021
2021-01-12
12/01/2021
12.1.2021
12 stycznia 2021
15.07.2025
15.07.2025 r.
15-07-2025
2025-07-15
15/07/2025
15.7.2025
15 czerwca 2025
28.03.2015
28.03.2015 r.
28-03-2015
2015-03-28
28/03/2015
28.3.2015
28 marca 2015
19.03.2021
19.03.2021 r.
19-03-2021
2021-03-19
19/03/2021
19.3.2021
19 marca 2021
21.04.2019
21.04.2019 r.
21-04-2019
2019-04-21
21/04/2019
21.4.2019
21 kwietnia 2019
01.01.2024
01.01.2024 r.
01-01-2024
2024-01-01
01/01/2024
1.1.2024
01 stycznia 2024
29.11.2024
29.11.2024 r.
29-11-2024
2024-11-29
29/11/2024
29 listopada 2024
16.05.2017
16.05.2017 r.
16-05-2017
2017-05-16
16/05/2017
16.5.2017
16 maj 2017
06.10.2024
06.10.2024 r.
06-10-2024
2024-10-06
06/10/2024
6.10.2024
06 October 2024
26.02.2019
26.02.2019 r.
26-02-2019
2019-02-26
26/02/2019
26.2.2019
26 lutego 2019
20.01.2019
20.01.2019 r.
20-01-2019
2019-01-20
20/01/2019
20.1.2019
20 stycznia 2019
01.03.2015
01.03.2015 r.
01-03-2015
2015-03-01
01/03/2015
1.3.2015
01 marca 2015
06.07.2025
06.07.2025 r.
06-07-2025
2025-07-06
06/07/2025
6.7.2025
06 czerwca 2025
25.08.2022
25.08.2022 r.
25-08-2022
2022-08-25
25/08/2022
25.8.2022
25 August 2022
29.02.2020
29.02.2020 r.
29-02-2020
2020-02-29
29/02/2020
29.2.2020
29 lutego 2020
20.07.2019
20.07.2019 r.
20-07-2019
2019-07-20
20/07/2019
20.7.2019
20 czerwca 2019
28.06.2018
28.06.2018 r.
28-06-2018
2018-06-28
28/06/2018
28.6.2018
28 lipcae 2018
12.02.2023
12.02.2023 r.
12-02-2023
2023-02-12
12/02/2023
12.2.2023
12 lutego 2023
12.12.2025
12.12.2025 r.
12-12-2025
2025-12-12
12/12/2025
12 December 2025
24.01.2020
24.01.2020 r.
24-01-2020
2020-01-24
24/01/2020
24.1.2020
24 stycznia 2020
02.08.2022
02.08.2022 r.
02-08-2022
2022-08-02
02/08/2022
2.8.2022
02 August 2022
03.04.2020
03.04.2020 r.
03-04-2020
2020-04-03
03/04/2020
3.4.2020
03 kwietnia 2020
20.01.2021
20.01.2021 r.
20-01-2021
2021-01-20
20/01/2021
20.1.2021
20 stycznia 2021
06.07.2023
06.07.2023 r.
06-07-2023
2023-07-06
06/07/2023
6.7.2023
06 czerwca 2023
26.04.2022
26.04.2022 r.
26-04-2022
2022-04-26
26/04/2022
26.4.2022
26 kwietnia 2022
22.03.2016
22.03.2016 r.
22-03-2016
2016-03-22
22/03/2016
22.3.2016
22 marca 2016
18.07.2018
18.07.2018 r.
18-07-2018
2018-07-18
18/07/2018
18.7.2018
18 czerwca 2018
02.01.2023
02.01.2023 r.
02-01-2023
2023-01-02
02/01/2023
2.1.2023
02 stycznia 2023
03.07.2019
03.07.2019 r.
03-07-2019
2019-07-03
03/07/2019
3.7.2019
03 czerwca 2019
11.02.2017
11.02.2017 r.
11-02-2017
2017-02-11
11/02/2017
11.2.2017
11 lutego 2017
13.09.2016
13.09.2016 r.
13-09-2016
2016-09-13
13/09/2016
13.9.2016
13 września 2016
07.07.2018
07.07.2018 r.
07-07-2018
2018-07-07
07/07/2018
7.7.2018
07 czerwca 2018
15.07.2016
15.07.2016 r.
15-07-2016
2016-07-15
15/07/2016
15.7.2016
15 czerwca 2016
18.09.2016
18.09.2016 r.
18-09-2016
2016-09-18
18/09/2016
18.9.2016
18 września 2016
05.07.2019
05.07.2019 r.
05-07-2019
2019-07-05
05/07/2019
5.7.2019
05 czerwca 2019
18.06.2019
18.06.2019 r.
18-06-2019
2019-06-18
18/06/2019
18.6.2019
18 lipcae 2019
01.08.2015
01.08.2015 r.
01-08-2015
2015-08-01
01/08/2015
1.8.2015
01 August 2015
26.02.2024
26.02.2024 r.
26-02-2024
2024-02-26
26/02/2024
26.2.2024
26 lutego 2024
05.06.2025
05.06.2025 r.
05-06-2025
2025-06-05
05/06/2025
5.6.2025
05 lipcae 2025
18.04.2023
18.04.2023 r.
18-04-2023
2023-04-18
18/04/2023
18.4.2023
18 kwietnia 2023
13.08.2016
13.08.2016 r.
13-08-2016
2016-08-13
13/08/2016
13.8.2016
13 August 2016
07.11.2020
07.11.2020 r.
07-11-2020
2020-11-07
07/11/2020
7.11.2020
07 listopada 2020
27.05.2021
27.05.2021 r.
27-05-2021
2021-05-27
27/05/2021
27.5.2021
27 maj 2021
04.08.2021
04.08.2021 r.
04-08-2021
2021-08-04
04/08/2021
4.8.2021
04 August 2021
06.12.2022
06.12.2022 r.
06-12-2022
2022-12-06
06/12/2022
6.12.2022
06 December 2022
03.11.2017
03.11.2017 r.
03-11-2017
2017-11-03
03/11/2017
3.11.2017
03 listopada 2017
27.12.2017
27.12.2017 r.
27-12-2017
2017-12-27
27/12/2017
27 December 2017
15.07.2018
15.07.2018 r.
15-07-2018
2018-07-15
15/07/2018
15.7.2018
15 czerwca 2018
10.08.2023
10.08.2023 r.
10-08-2023
2023-08-10
10/08/2023
10.8.2023
10 August 2023
30.07.2017
30.07.2017 r.
30-07-2017
2017-07-30
30/07/2017
30.7.2017
30 czerwca 2017
14.07.2021
14.07.2021 r.
14-07-2021
2021-07-14
14/07/2021
14.7.2021
14 czerwca 2021
16.04.2019
16.04.2019 r.
16-04-2019
2019-04-16
16/04/2019
16.4.2019
16 kwietnia 2019
10.02.2015
10.02.2015 r.
10-02-2015
2015-02-10
10/02/2015
10.2.2015
10 lutego 2015
31.03.2019
31.03.2019 r.
31-03-2019
2019-03-31
31/03/2019
31.3.2019
31 marca 2019
22.11.2015
22.11.2015 r.
22-11-2015
2015-11-22
22/11/2015
22 listopada 2015
26.06.2025
26.06.2025 r.
26-06-2025
2025-06-26
26/06/2025
26.6.2025
26 lipcae 2025
21.12.2019
21.12.2019 r.
21-12-2019
2019-12-21
21/12/2019
21 December 2019
06.05.2019
06.05.2019 r.
06-05-2019
2019-05-06
06/05/2019
6.5.2019
06 maj 2019
19.05.2025
19.05.2025 r.
19-05-2025
2025-05-19
19/05/2025
19.5.2025
19 maj 2025
17.03.2017
17.03.2017 r.
17-03-2017
2017-03-17
17/03/2017
17.3.2017
17 marca 2017
29.09.2022
29.09.2022 r.
29-09-2022
2022-09-29
29/09/2022
29.9.2022
29 września 2022
19.11.2021
19.11.2021 r.
19-11-2021
2021-11-19
19/11/2021
19 listopada 2021
16.11.2023
16.11.2023 r.
16-11-2023
2023-11-16
16/11/2023
16 listopada 2023
27.04.2019
27.04.2019 r.
27-04-2019
2019-04-27
27/04/2019
27.4.2019
27 kwietnia 2019
29.11.2017
29.11.2017 r.
29-11-2017
2017-11-29
29/11/2017
29 listopada 2017
31.12.2023
31.12.2023 r.
31-12-2023
2023-12-31
31/12/2023
31 December 2023
21.07.2018
21.07.2018 r.
21-07-2018
2018-07-21
21/07/2018
21.7.2018
21 czerwca 2018
25.10.2017
25.10.2017 r.
25-10-2017
2017-10-25
25/10/2017
25 October 2017
07.01.2018
07.01.2018 r.
07-01-2018
2018-01-07
07/01/2018
7.1.2018
07 stycznia 2018
08.08.2015
08.08.2015 r.
08-08-2015
2015-08-08
08/08/2015
8.8.2015
08 August 2015
12.02.2022
12.02.2022 r.
12-02-2022
2022-02-12
12/02/2022
12.2.2022
12 lutego 2022
07.02.2021
07.02.2021 r.
07-02-2021
2021-02-07
07/02/2021
7.2.2021
07 lutego 2021
28.10.2018
28.10.2018 r.
28-10-2018
2018-10-28
28/10/2018
28 October 2018
23.01.2020
23.01.2020 r.
23-01-2020
2020-01-23
23/01/2020
23.1.2020
23 stycznia 2020
10.01.2020
10.01.2020 r.
10-01-2020
2020-01-10
10/01/2020
10.1.2020
10 stycznia 2020
12.11.2016
12.11.2016 r.
12-11-2016
2016-11-12
12/11/2016
12 listopada 2016
06.12.2021
06.12.2021 r.
06-12-2021
2021-12-06
06/12/2021
6.12.2021
06 December 2021
21.12.2016
21.12.2016 r.
21-12-2016
2016-12-21
21/12/2016
21 December 2016
24.02.2020
24.02.2020 r.
24-02-2020
2020-02-24
24/02/2020
24.2.2020
24 lutego 2020
18.01.2016
18.01.2016 r.
18-01-2016
2016-01-18
18/01/2016
18.1.2016
18 stycznia 2016
18.01.2022
18.01.2022 r.
18-01-2022
2022-01-18
18/01/2022
18.1.2022
18 stycznia 2022
04.03.2020
04.03.2020 r.
04-03-2020
2020-03-04
04/03/2020
4.3.2020
04 marca 2020
10.05.2015
10.05.2015 r.
10-05-2015
2015-05-10
10/05/2015
10.5.2015
10 maj 2015
17.12.2015
17.12.2015 r.
17-12-2015
2015-12-17
17/12/2015
17 December 2015
25.02.2021
25.02.2021 r.
25-02-2021
2021-02-25
25/02/2021
25.2.2021
25 lutego 2021
08.03.2020
08.03.2020 r.
08-03-2020
2020-03-08
08/03/2020
8.3.2020
08 marca 2020
27.09.2015
27.09.2015 r.
27-09-2015
2015-09-27
27/09/2015
27.9.2015
27 września 2015
08.05.2019
08.05.2019 r.
08-05-2019
2019-05-08
08/05/2019
8.5.2019
08 maj 2019
11.05.2025
11.05.2025 r.
11-05-2025
2025-05-11
11/05/2025
11.5.2025
11 maj 2025
07.07.2020
07.07.2020 r.
07-07-2020
2020-07-07
07/07/2020
7.7.2020
07 czerwca 2020
11.06.2022
11.06.2022 r.
11-06-2022
2022-06-11
11/06/2022
11.6.2022
11 lipcae 2022
19.08.2019
19.08.2019 r.
19-08-2019
2019-08-19
19/08/2019
19.8.2019
19 August 2019
17.05.2015
17.05.2015 r.
17-05-2015
2015-05-17
17/05/2015
17.5.2015
17 maj 2015
08.12.2019
08.12.2019 r.
08-12-2019
2019-12-08
08/12/2019
8.12.2019
08 December 2019
21.04.2022
21.04.2022 r.
21-04-2022
2022-04-21
21/04/2022
21.4.2022
21 kwietnia 2022
27.04.2015
27.04.2015 r.
27-04-2015
2015-04-27
27/04/2015
27.4.2015
27 kwietnia 2015
26.01.2020
26.01.2020 r.
26-01-2020
2020-01-26
26/01/2020
26.1.2020
26 stycznia 2020
01.08.2020
01.08.2020 r.
01-08-2020
2020-08-01
01/08/2020
1.8.2020
01 August 2020
17.04.2020
17.04.2020 r.
17-04-2020
2020-04-17
17/04/2020
17.4.2020
17 kwietnia 2020
05.11.2025
05.11.2025 r.
05-11-2025
2025-11-05
05/11/2025
5.11.2025
05 listopada 2025
07.09.2018
07.09.2018 r.
07-09-2018
2018-09-07
07/09/2018
7.9.2018
07 września 2018
