23.08.1950
23-08-1950
1950-08-23
23/08/1950
23 August 1950
23.08.50
23.8.1950
25.06.2003
25-06-2003
2003-06-25
25/06/2003
25 June 2003
25.06.03
25.6.2003
29.09.1987
29-09-1987
1987-09-29
29/09/1987
29 September 1987
29.09.87
29.9.1987
07.06.2010
07-06-2010
2010-06-07
07/06/2010
07 June 2010
07.06.10
7.6.2010
31.08.1964
31-08-1964
1964-08-31
31/08/1964
31 August 1964
31.08.64
31.8.1964
10.06.2001
10-06-2001
2001-06-10
10/06/2001
10 June 2001
10.06.01
10.6.2001
04.04.1989
04-04-1989
1989-04-04
04/04/1989
04 April 1989
04.04.89
4.4.1989
21.05.1968
21-05-1968
1968-05-21
21/05/1968
21 May 1968
21.05.68
21.5.1968
16.02.1965
16-02-1965
1965-02-16
16/02/1965
16 February 1965
16.02.65
16.2.1965
28.08.1969
28-08-1969
1969-08-28
28/08/1969
28 August 1969
28.08.69
28.8.1969
10.12.1956
10-12-1956
1956-12-10
10/12/1956
10 December 1956
10.12.56
04.08.1990
04-08-1990
1990-08-04
04/08/1990
04 August 1990
04.08.90
4.8.1990
10.09.1966
10-09-1966
1966-09-10
10/09/1966
10 September 1966
10.09.66
10.9.1966
12.10.1996
12-10-1996
1996-10-12
12/10/1996
12 October 1996
12.10.96
28.08.1956
28-08-1956
1956-08-28
28/08/1956
28 August 1956
28.08.56
28.8.1956
18.11.1991
18-11-1991
1991-11-18
18/11/1991
18 November 1991
18.11.91
01.05.1970
01-05-1970
1970-05-01
01/05/1970
01 May 1970
01.05.70
1.5.1970
11.08.1958
11-08-1958
1958-08-11
11/08/1958
11 August 1958
11.08.58
11.8.1958
13.10.1951
13-10-1951
1951-10-13
13/10/1951
13 October 1951
13.10.51
17.01.1988
17-01-1988
1988-01-17
17/01/1988
17 January 1988
17.01.88
17.1.1988
11.12.1974
11-12-1974
1974-12-11
11/12/1974
11 December 1974
11.12.74
04.07.1958
04-07-1958
1958-07-04
04/07/1958
04 July 1958
04.07.58
4.7.1958
26.12.1971
26-12-1971
1971-12-26
26/12/1971
26 December 1971
26.12.71
24.07.1961
24-07-1961
1961-07-24
24/07/1961
24 July 1961
24.07.61
24.7.1961
25.09.1986
25-09-1986
1986-09-25
25/09/1986
25 September 1986
25.09.86
25.9.1986
01.11.1964
01-11-1964
1964-11-01
01/11/1964
01 November 1964
01.11.64
1.11.1964
02.11.1993
02-11-1993
1993-11-02
02/11/1993
02 November 1993
02.11.93
2.11.1993
07.05.1985
07-05-1985
1985-05-07
07/05/1985
07 May 1985
07.05.85
7.5.1985
27.04.1951
27-04-1951
1951-04-27
27/04/1951
27 April 1951
27.04.51
27.4.1951
14.07.1975
14-07-1975
1975-07-14
14/07/1975
14 July 1975
14.07.75
14.7.1975
23.03.2005
23-03-2005
2005-03-23
23/03/2005
23 March 2005
23.03.05
23.3.2005
25.07.1977
25-07-1977
1977-07-25
25/07/1977
25 July 1977
25.07.77
25.7.1977
06.09.1963
06-09-1963
1963-09-06
06/09/1963
06 September 1963
06.09.63
6.9.1963
10.12.1994
10-12-1994
1994-12-10
10/12/1994
10 December 1994
10.12.94
13.11.1950
13-11-1950
1950-11-13
13/11/1950
13 November 1950
13.11.50
25.09.1981
25-09-1981
1981-09-25
25/09/1981
25 September 1981
25.09.81
25.9.1981
20.07.1960
20-07-1960
1960-07-20
20/07/1960
20 July 1960
20.07.60
20.7.1960
18.04.1954
18-04-1954
1954-04-18
18/04/1954
18 April 1954
18.04.54
18.4.1954
25.09.1957
25-09-1957
1957-09-25
25/09/1957
25 September 1957
25.09.57
25.9.1957
23.09.1970
23-09-1970
1970-09-23
23/09/1970
23 September 1970
23.09.70
23.9.1970
26.09.1970
26-09-1970
1970-09-26
26/09/1970
26 September 1970
26.09.70
26.9.1970
25.02.1954
25-02-1954
1954-02-25
25/02/1954
25 February 1954
25.02.54
25.2.1954
11.06.1994
11-06-1994
1994-06-11
11/06/1994
11 June 1994
11.06.94
11.6.1994
24.01.1950
24-01-1950
1950-01-24
24/01/1950
24 January 1950
24.01.50
24.1.1950
20.10.1986
20-10-1986
1986-10-20
20/10/1986
20 October 1986
20.10.86
25.01.2001
25-01-2001
2001-01-25
25/01/2001
25 January 2001
25.01.01
25.1.2001
22.01.1976
22-01-1976
1976-01-22
22/01/1976
22 January 1976
22.01.76
22.1.1976
08.12.1954
08-12-1954
1954-12-08
08/12/1954
08 December 1954
08.12.54
8.12.1954
09.09.2006
09-09-2006
2006-09-09
09/09/2006
09 September 2006
09.09.06
9.9.2006
12.12.2002
12-12-2002
2002-12-12
12/12/2002
12 December 2002
12.12.02
24.10.1979
24-10-1979
1979-10-24
24/10/1979
24 October 1979
24.10.79
20.08.1978
20-08-1978
1978-08-20
20/08/1978
20 August 1978
20.08.78
20.8.1978
02.02.1963
02-02-1963
1963-02-02
02/02/1963
02 February 1963
02.02.63
2.2.1963
29.01.2008
29-01-2008
2008-01-29
29/01/2008
29 January 2008
29.01.08
29.1.2008
31.08.1966
31-08-1966
1966-08-31
31/08/1966
31 August 1966
31.08.66
31.8.1966
03.07.1966
03-07-1966
1966-07-03
03/07/1966
03 July 1966
03.07.66
3.7.1966
28.07.1989
28-07-1989
1989-07-28
28/07/1989
28 July 1989
28.07.89
28.7.1989
17.05.1982
17-05-1982
1982-05-17
17/05/1982
17 May 1982
17.05.82
17.5.1982
16.03.1974
16-03-1974
1974-03-16
16/03/1974
16 March 1974
16.03.74
16.3.1974
04.06.2002
04-06-2002
2002-06-04
04/06/2002
04 June 2002
04.06.02
4.6.2002
22.10.1971
22-10-1971
1971-10-22
22/10/1971
22 October 1971
22.10.71
25.04.1986
25-04-1986
1986-04-25
25/04/1986
25 April 1986
25.04.86
25.4.1986
29.04.1983
29-04-1983
1983-04-29
29/04/1983
29 April 1983
29.04.83
29.4.1983
26.05.1995
26-05-1995
1995-05-26
26/05/1995
26 May 1995
26.05.95
26.5.1995
07.04.2009
07-04-2009
2009-04-07
07/04/2009
07 April 2009
07.04.09
7.4.2009
16.02.1998
16-02-1998
1998-02-16
16/02/1998
16 February 1998
16.02.98
16.2.1998
13.09.1986
13-09-1986
1986-09-13
13/09/1986
13 September 1986
13.09.86
13.9.1986
27.01.2009
27-01-2009
2009-01-27
27/01/2009
27 January 2009
27.01.09
27.1.2009
21.05.1997
21-05-1997
1997-05-21
21/05/1997
21 May 1997
21.05.97
21.5.1997
13.01.1972
13-01-1972
1972-01-13
13/01/1972
13 January 1972
13.01.72
13.1.1972
29.09.1968
29-09-1968
1968-09-29
29/09/1968
29 September 1968
29.09.68
29.9.1968
20.05.1962
20-05-1962
1962-05-20
20/05/1962
20 May 1962
20.05.62
20.5.1962
16.09.1976
16-09-1976
1976-09-16
16/09/1976
16 September 1976
16.09.76
16.9.1976
15.07.2004
15-07-2004
2004-07-15
15/07/2004
15 July 2004
15.07.04
15.7.2004
06.08.1991
06-08-1991
1991-08-06
06/08/1991
06 August 1991
06.08.91
6.8.1991
24.10.1977
24-10-1977
1977-10-24
24/10/1977
24 October 1977
24.10.77
16.05.1986
16-05-1986
1986-05-16
16/05/1986
16 May 1986
16.05.86
16.5.1986
20.08.1951
20-08-1951
1951-08-20
20/08/1951
20 August 1951
20.08.51
20.8.1951
29.03.1992
29-03-1992
1992-03-29
29/03/1992
29 March 1992
29.03.92
29.3.1992
05.02.1997
05-02-1997
1997-02-05
05/02/1997
05 February 1997
05.02.97
5.2.1997
09.05.1976
09-05-1976
1976-05-09
09/05/1976
09 May 1976
09.05.76
9.5.1976
14.10.1998
14-10-1998
1998-10-14
14/10/1998
14 October 1998
14.10.98
25.10.1969
25-10-1969
1969-10-25
25/10/1969
25 October 1969
25.10.69
08.09.1987
08-09-1987
1987-09-08
08/09/1987
08 September 1987
08.09.87
8.9.1987
25.03.2003
25-03-2003
2003-03-25
25/03/2003
25 March 2003
25.03.03
25.3.2003
12.01.1965
12-01-1965
1965-01-12
12/01/1965
12 January 1965
12.01.65
12.1.1965
29.05.2004
29-05-2004
2004-05-29
29/05/2004
29 May 2004
29.05.04
29.5.2004
12.12.1959
12-12-1959
1959-12-12
12/12/1959
12 December 1959
12.12.59
21.07.2001
21-07-2001
2001-07-21
21/07/2001
21 July 2001
21.07.01
21.7.2001
19.01.1975
19-01-1975
1975-01-19
19/01/1975
19 January 1975
19.01.75
19.1.1975
21.02.1985
21-02-1985
1985-02-21
21/02/1985
21 February 1985
21.02.85
21.2.1985
20.08.1964
20-08-1964
1964-08-20
20/08/1964
20 August 1964
20.08.64
20.8.1964
31.05.1993
31-05-1993
1993-05-31
31/05/1993
31 May 1993
31.05.93
31.5.1993
28.09.1963
28-09-1963
1963-09-28
28/09/1963
28 September 1963
28.09.63
28.9.1963
20.02.1967
20-02-1967
1967-02-20
20/02/1967
20 February 1967
20.02.67
20.2.1967
15.08.1982
15-08-1982
1982-08-15
15/08/1982
15 August 1982
15.08.82
15.8.1982
02.09.1995
02-09-1995
1995-09-02
02/09/1995
02 September 1995
02.09.95
2.9.1995
25.09.1982
25-09-1982
1982-09-25
25/09/1982
25 September 1982
25.09.82
25.9.1982
04.01.1962
04-01-1962
1962-01-04
04/01/1962
04 January 1962
04.01.62
4.1.1962
01.10.1955
01-10-1955
1955-10-01
01/10/1955
01 October 1955
01.10.55
1.10.1955
19.08.1957
19-08-1957
1957-08-19
19/08/1957
19 August 1957
19.08.57
19.8.1957
02.09.1953
02-09-1953
1953-09-02
02/09/1953
02 September 1953
02.09.53
2.9.1953
23.09.1981
23-09-1981
1981-09-23
23/09/1981
23 September 1981
23.09.81
23.9.1981
03.04.2010
03-04-2010
2010-04-03
03/04/2010
03 April 2010
03.04.10
3.4.2010
23.05.1951
23-05-1951
1951-05-23
23/05/1951
23 May 1951
23.05.51
23.5.1951
05.04.1959
05-04-1959
1959-04-05
05/04/1959
05 April 1959
05.04.59
5.4.1959
05.02.1966
05-02-1966
1966-02-05
05/02/1966
05 February 1966
05.02.66
5.2.1966
14.12.1952
14-12-1952
1952-12-14
14/12/1952
14 December 1952
14.12.52
26.09.1998
26-09-1998
1998-09-26
26/09/1998
26 September 1998
26.09.98
26.9.1998
30.09.2004
30-09-2004
2004-09-30
30/09/2004
30 September 2004
30.09.04
30.9.2004
27.05.1962
27-05-1962
1962-05-27
27/05/1962
27 May 1962
27.05.62
27.5.1962
03.08.2008
03-08-2008
2008-08-03
03/08/2008
03 August 2008
03.08.08
3.8.2008
21.07.2000
21-07-2000
2000-07-21
21/07/2000
21 July 2000
21.07.00
21.7.2000
13.04.1955
13-04-1955
1955-04-13
13/04/1955
13 April 1955
13.04.55
13.4.1955
03.12.1952
03-12-1952
1952-12-03
03/12/1952
03 December 1952
03.12.52
3.12.1952
16.09.1967
16-09-1967
1967-09-16
16/09/1967
16 September 1967
16.09.67
16.9.1967
30.03.1972
30-03-1972
1972-03-30
30/03/1972
30 March 1972
30.03.72
30.3.1972
02.07.1962
02-07-1962
1962-07-02
02/07/1962
02 July 1962
02.07.62
2.7.1962
12.02.1980
12-02-1980
1980-02-12
12/02/1980
12 February 1980
12.02.80
12.2.1980
27.06.1993
27-06-1993
1993-06-27
27/06/1993
27 June 1993
27.06.93
27.6.1993
12.04.1951
12-04-1951
1951-04-12
12/04/1951
12 April 1951
12.04.51
12.4.1951
06.08.1981
06-08-1981
1981-08-06
06/08/1981
06 August 1981
06.08.81
6.8.1981
11.05.1996
11-05-1996
1996-05-11
11/05/1996
11 May 1996
11.05.96
11.5.1996
05.12.2010
05-12-2010
2010-12-05
05/12/2010
05 December 2010
05.12.10
5.12.2010
24.09.1986
24-09-1986
1986-09-24
24/09/1986
24 September 1986
24.09.86
24.9.1986
19.04.1954
19-04-1954
1954-04-19
19/04/1954
19 April 1954
19.04.54
19.4.1954
22.07.2004
22-07-2004
2004-07-22
22/07/2004
22 July 2004
22.07.04
22.7.2004
20.09.1962
20-09-1962
1962-09-20
20/09/1962
20 September 1962
20.09.62
20.9.1962
18.01.2005
18-01-2005
2005-01-18
18/01/2005
18 January 2005
18.01.05
18.1.2005
25.03.1990
25-03-1990
1990-03-25
25/03/1990
25 March 1990
25.03.90
25.3.1990
20.02.1982
20-02-1982
1982-02-20
20/02/1982
20 February 1982
20.02.82
20.2.1982
14.11.1985
14-11-1985
1985-11-14
14/11/1985
14 November 1985
14.11.85
13.05.1977
13-05-1977
1977-05-13
13/05/1977
13 May 1977
13.05.77
13.5.1977
17.08.2009
17-08-2009
2009-08-17
17/08/2009
17 August 2009
17.08.09
17.8.2009
21.04.1965
21-04-1965
1965-04-21
21/04/1965
21 April 1965
21.04.65
21.4.1965
26.05.1987
26-05-1987
1987-05-26
26/05/1987
26 May 1987
26.05.87
26.5.1987
06.01.1965
06-01-1965
1965-01-06
06/01/1965
06 January 1965
06.01.65
6.1.1965
08.01.2000
08-01-2000
2000-01-08
08/01/2000
08 January 2000
08.01.00
8.1.2000
13.05.1958
13-05-1958
1958-05-13
13/05/1958
13 May 1958
13.05.58
13.5.1958
11.10.1953
11-10-1953
1953-10-11
11/10/1953
11 October 1953
11.10.53
19.08.1961
19-08-1961
1961-08-19
19/08/1961
19 August 1961
19.08.61
19.8.1961
06.07.1955
06-07-1955
1955-07-06
06/07/1955
06 July 1955
06.07.55
6.7.1955
10.12.1999
10-12-1999
1999-12-10
10/12/1999
10 December 1999
10.12.99
12.11.1952
12-11-1952
1952-11-12
12/11/1952
12 November 1952
12.11.52
30.10.1958
30-10-1958
1958-10-30
30/10/1958
30 October 1958
30.10.58
09.10.1992
09-10-1992
1992-10-09
09/10/1992
09 October 1992
09.10.92
9.10.1992
10.04.1976
10-04-1976
1976-04-10
10/04/1976
10 April 1976
10.04.76
10.4.1976
09.05.2004
09-05-2004
2004-05-09
09/05/2004
09 May 2004
09.05.04
9.5.2004
08.02.1963
08-02-1963
1963-02-08
08/02/1963
08 February 1963
08.02.63
8.2.1963
11.08.1960
11-08-1960
1960-08-11
11/08/1960
11 August 1960
11.08.60
11.8.1960
23.08.1987
23-08-1987
1987-08-23
23/08/1987
23 August 1987
23.08.87
23.8.1987
12.02.1970
12-02-1970
1970-02-12
12/02/1970
12 February 1970
12.02.70
12.2.1970
05.09.1964
05-09-1964
1964-09-05
05/09/1964
05 September 1964
05.09.64
5.9.1964
11.07.1990
11-07-1990
1990-07-11
11/07/1990
11 July 1990
11.07.90
11.7.1990
22.10.1967
22-10-1967
1967-10-22
22/10/1967
22 October 1967
22.10.67
05.09.1971
05-09-1971
1971-09-05
05/09/1971
05 September 1971
05.09.71
5.9.1971
30.05.1960
30-05-1960
1960-05-30
30/05/1960
30 May 1960
30.05.60
30.5.1960
05.05.1986
05-05-1986
1986-05-05
05/05/1986
05 May 1986
05.05.86
5.5.1986
13.01.1984
13-01-1984
1984-01-13
13/01/1984
13 January 1984
13.01.84
13.1.1984
08.09.2000
08-09-2000
2000-09-08
08/09/2000
08 September 2000
08.09.00
8.9.2000
11.08.1975
11-08-1975
1975-08-11
11/08/1975
11 August 1975
11.08.75
11.8.1975
14.11.1968
14-11-1968
1968-11-14
14/11/1968
14 November 1968
14.11.68
12.07.1998
12-07-1998
1998-07-12
12/07/1998
12 July 1998
12.07.98
12.7.1998
01.12.1997
01-12-1997
1997-12-01
01/12/1997
01 December 1997
01.12.97
1.12.1997
10.02.1960
10-02-1960
1960-02-10
10/02/1960
10 February 1960
10.02.60
10.2.1960
23.11.1978
23-11-1978
1978-11-23
23/11/1978
23 November 1978
23.11.78
09.11.1953
09-11-1953
1953-11-09
09/11/1953
09 November 1953
09.11.53
9.11.1953
19.02.2001
19-02-2001
2001-02-19
19/02/2001
19 February 2001
19.02.01
19.2.2001
15.02.1963
15-02-1963
1963-02-15
15/02/1963
15 February 1963
15.02.63
15.2.1963
01.06.2007
01-06-2007
2007-06-01
01/06/2007
01 June 2007
01.06.07
1.6.2007
02.01.1996
02-01-1996
1996-01-02
02/01/1996
02 January 1996
02.01.96
2.1.1996
08.08.2000
08-08-2000
2000-08-08
08/08/2000
08 August 2000
08.08.00
8.8.2000
05.11.1953
05-11-1953
1953-11-05
05/11/1953
05 November 1953
05.11.53
5.11.1953
21.03.2001
21-03-2001
2001-03-21
21/03/2001
21 March 2001
21.03.01
21.3.2001
20.08.2008
20-08-2008
2008-08-20
20/08/2008
20 August 2008
20.08.08
20.8.2008
06.12.1991
06-12-1991
1991-12-06
06/12/1991
06 December 1991
06.12.91
6.12.1991
04.08.1959
04-08-1959
1959-08-04
04/08/1959
04 August 1959
04.08.59
4.8.1959
24.05.1981
24-05-1981
1981-05-24
24/05/1981
24 May 1981
24.05.81
24.5.1981
24.01.1982
24-01-1982
1982-01-24
24/01/1982
24 January 1982
24.01.82
24.1.1982
06.06.2006
06-06-2006
2006-06-06
06/06/2006
06 June 2006
06.06.06
6.6.2006
08.10.1986
08-10-1986
1986-10-08
08/10/1986
08 October 1986
08.10.86
8.10.1986
01.03.2009
01-03-2009
2009-03-01
01/03/2009
01 March 2009
01.03.09
1.3.2009
01.09.1998
01-09-1998
1998-09-01
01/09/1998
01 September 1998
01.09.98
1.9.1998
09.01.1993
09-01-1993
1993-01-09
09/01/1993
09 January 1993
09.01.93
9.1.1993
21.05.1959
21-05-1959
1959-05-21
21/05/1959
21 May 1959
21.05.59
21.5.1959
15.09.1955
15-09-1955
1955-09-15
15/09/1955
15 September 1955
15.09.55
15.9.1955
20.10.1973
20-10-1973
1973-10-20
20/10/1973
20 October 1973
20.10.73
03.02.1954
03-02-1954
1954-02-03
03/02/1954
03 February 1954
03.02.54
3.2.1954
21.08.1993
21-08-1993
1993-08-21
21/08/1993
21 August 1993
21.08.93
21.8.1993
05.06.1973
05-06-1973
1973-06-05
05/06/1973
05 June 1973
05.06.73
5.6.1973
19.08.1997
19-08-1997
1997-08-19
19/08/1997
19 August 1997
19.08.97
19.8.1997
13.11.1980
13-11-1980
1980-11-13
13/11/1980
13 November 1980
13.11.80
11.10.1952
11-10-1952
1952-10-11
11/10/1952
11 October 1952
11.10.52
29.09.1980
29-09-1980
1980-09-29
29/09/1980
29 September 1980
29.09.80
29.9.1980
23.06.1970
23-06-1970
1970-06-23
23/06/1970
23 June 1970
23.06.70
23.6.1970
08.11.2001
08-11-2001
2001-11-08
08/11/2001
08 November 2001
08.11.01
8.11.2001
13.11.2009
13-11-2009
2009-11-13
13/11/2009
13 November 2009
13.11.09
05.12.1992
05-12-1992
1992-12-05
05/12/1992
05 December 1992
05.12.92
5.12.1992
25.10.1974
25-10-1974
1974-10-25
25/10/1974
25 October 1974
25.10.74
30.07.1997
30-07-1997
1997-07-30
30/07/1997
30 July 1997
30.07.97
30.7.1997
